title,content,upvotes,comments,post_age
Parents kept my mental illness a secret from me for 3 years. I had early onset childhood Schizophrenia at age 12. How do you think parents should go about breaking the news to a young child?,parents kept my mental illness a secret from me i had early onset childhood schizophrenia at age 12 i found out about my illness on my own about 3 years later at age 15 i was mad because they kept it a secret from me for 3 years it was 3 long years i was very mad when i knew the truth because they lied they did not come clean with me i found out myself i could not accept my own illness on the day i realized i had it it was a total breakdown being unable to accept the reality i found out about my own illness when i went online to find out what my medication is for i thought it was ptsd at first i felt like a fool they said it was too hard to tell me the truth because i was so young at that time they could not accept that i had schizophrenia at age 12 how do you think parents should go about breaking the news to a young child,409,92,1653.381586
I finally told my mom,i am 19m and just told my mom about the sexual abuse from when i was 12 that i kept a secret for years i also told her the ptsd i have from it she was very supportive and loving and made me promise to give her a big hug when i saw her next which i obviously did it s still a big struggle but having her unconditional love and support means the world to me she said she would move heaven and earth to help me it was really hard to tell her so i had to by writing a letter putting it on her bed and going to a friends house,409,56,1817.368507
To anyone who needs to see this: you are not your past trauma.,you are so much more the past cannot be changed we can only learn and grow through it you have been placed on this earth to do and become great things,408,48,1393.303055
Has anyone else been excluded their entire life,i ve always been the odd one out every situation i can think of school previous jobs friends relationships even by family people go places without me and it s been this way for as long as i can remember when we ve been placed into groups in school i always tried to talk to everyone but still i noticed they just clicked better with each other same thing at my old job i was just never good enough people don t gravitate towards me and never have no matter how talkative and friendly i am i m sure you ve guessed it by now yes i ve always been the therapist friend who never got anything in return now the one person who i m the closest with and love the most went to breakfast with all his friends and i was invited but he left without telling me the plans were still on and excludes me from other plans too now i constantly question what s wrong with me i always try to talk and include myself and it ll work for the time being but then i end up being excluded again i can t do this anymore,409,76,1706.235613
I'm clean from self harm :),i dont know exactly how long but i havent hurt myself for at least 6 months i m proud of myself because i get the urge to do it really often still edit thank you for everyone who has commented all this support is overwhelming,406,64,1965.052731
I finally shaved!!!,before anyone asks i am a girl i haven t shaved in months and if you re grossed out by that stop reading now i haven t shaved anywhere legs armpits pubic area it just seemed too overwhelming my boyfriend doesn t mind so my sex life didn t really get worse because of that and i live in a colder climate so wearing long pants during the summer was completely normal to be honest i kinda liked how things were less waste more time less skin irritation and stuff but i knew it didn t come from my worldview but from my depression shaving is the least important as i could go days without eating without brushing my teeth and showering so before i go on shaving isn t necessary showering is so if you re a male female whatever just don t shave if you don t want to it s not a part of hygiene you won t sweat more because of some hair but take a shower from time to time not a full on spa singing one hour shower but get in there for a few minutes even if it ll be just standing under pouring water but if you want to just like i did go for it i shaved my whole body today i used some coconut oil on my legs and scented oil under my armpits zero waste deodorant apart from that i also did a full on skin care routine and brushed my teeth and flossed wow i m sure most people do it regularly and it grosses them out when they have a single piece of salad between their teeth after a meal but for me it was a huge milestone i hope to do it again tomorrow without forcing myself i haven t felt this fresh and sexey in quite some time next goal laundry,408,38,1975.086574
"Mental illnesses do not affect us in equal ways, but they all suck.",my sentiments are based on being subscribed to the sub and seeing a pattern in which posts make it into my feed this is not an attack on the sub it s a suggestion to represent all the colors of the rainbow here this sub seems to mostly pay attention and support people whose mental illness makes it difficult for them to perform basic functions like getting out of bed i understand that life with mental illness is like a 10k race for those struggling with the basics every day moving a yard feels like a war against yourself but what about those of us who are sprinting i leave my house daily for work social gatherings etc but i face many difficulties each day stemming from mental illness i come here and i make posts about it hoping to find someone who feels the same who lives that struggle just one person who relates and reaches out and says yeah i m drowning in my own thoughts too or hey i used to struggle with that here s what helped me but i get nothing and i see no posts on my feed from others who live a similar struggle i m sure they re out there but their posts get buried or if they re anything like me they delete them later because if no one feels the same what s the point all the support goes to the ones who seem to be struggling the most outwardly it reminds me of when i was a kid and i had a troubled sister i went to school had poems put in the newspaper great grades and had a few short stories published in books but no one in my home paid any mind when i left for college i asked my mother why she left me to my own devices so often why she didn t put so much effort into me like with my sister she replied because you ve always done so well on your own i didn t think you need me that has stuck with me even to this day and that s how i feel about this sub the support isn t shared and i think we all could do more to make sure there s a variety of lifestyles affected by mental illness getting the attention they deserve no struggle is worth more than another but they all need some help,405,29,2141.328449
Anyone else feels like something changed after the pandemic?,ik a lot of ppl were feeling lonely during the pandemic but does anyone else feels like this feeling doesn t go away its like something changed idk how to explain but everything feels different now i still feel lonely and it doesn t matter how much i try to go out it even seems like my family is more distant now even tho we are having family gatherings again it also doesn t help that i basically became an adult during the pandemic and entered college shortly after it was ending still i can t shake the feeling that something is wrong everything from before seems so distant too idk how to explain honestly i basically still feel isolated does anyone else feel the same,404,114,847.9271295
I don’t think people realise,how tiring it is to go through every day without trying to kill yourself,405,41,1448.15868
"You’re not a fucking manic pixie dream girl, and mania is not cute",just needed to vent this out really sick of the trivialization of mental illnesses but lately especially the notion that mania is cute or that being a manic girl is somehow attractive i currently intern in inpatient psych and the bipolar patients i work with often cause major destruction to their lives during manic periods it s just gross the memefication of mental illness is disturbing edit in case i was unclear i m referring to people who are not bipolar who romanticize mania when they do not have to deal with the things people who have the disorder do have to deal with edit 2 i realize the manic pixie dream girl trope was not an appropriate reference learned my lesson y all,407,126,2083.192477
I put blankets over my head when I'm sad and pretend I'm a turtle.,i know it sounds silly but i like to pretend that i m a turtle in its shell because if i cry in my shell no one can hurt me but the moment i come out of my shell i m no longer safe i know it s only a blanket i know it s just pretend but underneath a blanket i can be myself without harm update wow i fell asleep as a turtle and woke up to all these lovely messages thank you and cheers to all the turtles out there,406,32,2089.480428
Does anyone else feel guilty for their struggles with mental health?,ok i understand that guilt is a huge factor when it comes to people who struggle with mental health i have been diagnosed with did and severe generalized anxiety it has taken me years of medications various therapists and learned coping mechanisms to be the overall functioning human i am today everyday is still a struggle but i m at peace with that and just take things as they come the problem i have is that i sometimes feel like i don t deserve to have a mental illness if that makes sense i had a rough childhood but when i start to have a break down or anxiety attack i always think something along the lines of there are definitely people that have had it worse than i have and they are just fine or whatever is happening isn t as bad as what other people go through and i should just suck it up my rational healthy brain tells me everything is relative blah blah blah all the logical things a normal brain would think then my unhealthy brain just yells over the logic with intrusive thoughts that i don t deserve to have these mental issues because my life isn t that bad i feel like i may not be doing the best job of describing what i m feeling lol but can anyone relate edit thank you so much for all the comments and support it always makes things a little easier to know im not alone in this way of thinking i hope this posts helps others to realize the same thing you are valid you matter and the world would not be better without you in it stay safe and peaceful my friends,402,39,1691.712072
1 year clean!!,it s been exactly one year now since i ve been clean of any self harm i never thought i d make it one day one week let alone one year whoever is reading this know that you can do it it ll be hard and take time but you can bloody do it,409,61,1704.811956
Mental health has no direct “cure” and a lot of the times I think we have to figure it out on our own. Society doesn’t necessarily understand our struggle and we have to try and show them why mental health care is important.,mental health has no direct cure and a lot of the times i think we have to figure it out on our own i think the reason we have to figure it out on our own is because society and the health care system in place does not want to address mental health issues mental health is the most important part of any person s health period our mind dictates who we are and how we act this sub reddit is a good outlet to talk about what you are dealing with we care i care the government and healthcare probably won t look out for you we need to help each other always help each other through our mental issues so we can then help others through their mental issues that s love,403,51,1710.952674
"I know it's weird to celebrate but yesterday was the most ""normal"" day I've had in 3 years",it was fucking amazing i watched some football had a nap on the couch with my dog watched more football won some money off a bet i had made with lsu my mom came over and she and my fiance wrapped gifts while i was watching the lsu game afterwards i was still riding high so we went out to eat to celebrate even invited my girls best friend to join us as it would be my treat i didn t feel any anxiety or paranoia while we were eating came home and hung out minus my mom for another three hours it felt amazing to have a day where there was no episodes no panic no anxiety no paranoia no depression no hallucinating i know this sounds like a bragging post but remember this if one day can make up for three years keep fighting keep that hope know that you ll have a day similar and it ll carry you and it ll make you feel like you re living on cloud nine don t stop fighting guys,398,28,1914.300185
To the teenagers behind me at the store,i m sure you thought the comments you made about me were clever that must be why you said them loudly enough for everyone within 20 feet to hear i assume it was super amusing making fun of me based on the giggles and laughs from your group behind me as i used the self check out for the few things i was buying since you lot are obviously comedic geniuses i thought i d share your wittisms omg why would she ever leave her house in shorts said by the pretty blonde girl whose shirt i internally admired earlier you were pretty spot on since i d hadn t worn shorts outside my home in almost 2 years i had finally found a pair that fit well and were long enough so i thought they looked ok thank you for disabusing me of that notion she probably doesn t leave the house often anyway maybe she s afraid she won t fit through the door one of these days said from who i assume was blondie s boyfriend well you were wrong about the door thing that s a full on exaggeration because even i know i m not that big however you were right about me not leaving the house often but it has nothing to do with weight it s because i m still severely depressed over the unexpected passing of my fiancé less than 2 years ago look she s buying spinach i guarantee it s not for her this was from the brunette with blue highlights sorry to disappoint but it s totally for me why doesn t she just get that weight loss surgery she would obviously qualify from a different brunette well actually honey i already had it when i was 17 and barely qualified this was in the very early days of bariatric surgery and i obviously didn t have ideal results what s even worse though is it s left me with multiple life long health issues and chronic pain i ve had to have several additional surgeries to try and correct things with little success a lot of those health issues mean medication and many of those medications have weight gain as a side effect i also have hypothyroidism and polycystic ovary syndrome which both can cause weight gain as can depression which i mentioned earlier i d kill myself if i ever got that big said by blondie i guess it s a good you re not because no matter how horrible your comments i would never wish for you to feel like you needed to die and b i guess i m mentally stronger than you that s probably because of all the shit i ve been through but believe me there are often days when i think i d be better off dead and i d be lying if i didn t say how hard it was after hearing your comments to just make it to my car before i broke down crying i don t know why you all felt the need to be so cruel but i hope eventually you learn to have a little more empathy you don t know me or my story but you judged me based solely on my weight and found me lacking therefore i was worthy of your scorn your comments hurt and i imagine they will stick with me for awhile but they won t break me however someday if you continue this act you might end up being the last straw that does break someone i hope you never have to realize that your comments pushed a person to end their life and i also hope you never have to feel the way you made me feel today everyone please just keep in mind that you don t know what people are going through do better because not only is there no award for being a bad human but karma enjoys being an ironic bitch,405,67,904.9487962
"HEY YOU, COME HERE",i am here to sprinkle a dash of positivity i sincerely hope that you are able to overcome whatever troubles you whether it be mentally financially or the whole 9 yards and beyond i hope that one day the sun will shine a little brighter over your darkest days and those stinky little mean clouds go away so that the path to happiness and a life of no pain or worry is open hang in there you ve got this,401,55,1023.413368
I built a free mental health app after being stuck in my tiny studio in NYC,after being stuck in my tiny studio for a month due to covid 19 i started playing around with mental health apps out there however i noticed that most of them require at least 10 mins or more for me to consume the audio content and i often run out of patience trying to finish them i wanted an app that you can use without reserving much of your time happy is free to use and offers breathing techniques for keeping calm and relaxed shift your mind from stress and anxiety affirmation and positive quotes to shape your day sleeping tips and tricks calm relaxing music to enjoy free unlimited secure private journal online journal community to talk to people like you and more x200b ios android x200b hope you find it useful stay safe,402,65,1757.277338
is anyone super obsessed with how they walk?,like when no one is around you walk normal but when you see people you start to watch how you walk and end up looking stupid or at least you think you look stupid,400,69,1821.327373
Which mental health illness do you have?,i m doing this for reference wow i didn t expect all of these responses,399,590,262.8435416
I was 17 when the pandemic started. I’m now 20 but still feel 17.,it genuinely feels like i have not changed over the course of the last three years whatsoever high school feels like it just happened yesterday and i think i look nearly identical now as i did when i thought i was getting a two week spring break back in 2020 suddenly life has happened i don t even remember how i got here i m just 20 all of the sudden but i see myself still stuck at 17 i m having a really hard time digesting where my life went and what has happened the last three years i don t really know what this means or what to do i m just a really lost 20 year old am experiencing a weird age block trauma thing,395,87,1043.736771
ur telling me that people are out here living life with no mental illnesses? damn must be nice!,i can t even fathom having zero mental illness like how is that possible in today s age,404,63,1127.859491
Small accomplished but Showered and brushed my teeth for the first time in a week,a inor breakthrough but it made me feel alot better,403,34,1337.768403
Why do older generation people think depression is something we make up and it's just a western concept?,yesterday my mom was nagging me to tell her why i have been behaving weirdly i got fed up and told her i have been in depression for years and she called my dad well for starters they don t believe i m in depression because my face doesn t seem sad secondly i m not a doctor so i can t diagnose myself with depression and since i learned about depression from google apparently by reading too much about it my brain made me think i m in depression and that it didn t exist years back and it s just western culture and not exactly real when i told them a few reasons that included them they are saying this is what happens everywhere meaning this happens in every household and they don t see them depressed honestly i m tired but atleast after seeing me cry for hours they are searching for some therapists or psychologists nearby,402,124,1430.766782
"How do I explain my burnout to ""youre just lazy"" people?",not only burnout i also have depression i m 23 i don t have a job i could theoretically work a job but i would not perform well at the job at all and possibly get fired for being unproductive it would also do more harm than good to me but the main reason i don t have a job is because a job would drain my time and energy which i desperately need to work on my physical and mental health and also my to do list at home i just cannot handle any more responsibilities currently its too much im already fighting a battle 24 7 and i do not wanna attempt to work even harder than what is physically possible so now i often get judged you are 23 why dont you have a job or you should be studying you should why dont you but when i reply that i don t have time and energy for a job or whatever they want me to do they reply that i m just lazzy and privileged i guess that someone who has always been mentally healthy cannot understand what it feels like to be unmotivated to be physically tired or mentally to have a brain that does not function well to wake up tired even after 9 hours of sleep how am i supposed to reply to those you are lazy people,401,148,559.2804513
Anyone slowly realize they were very talented at something just to have mental illness destroy everything?,people who know me consider me very talented i mastered various hobbies in my past sport technical stuff and could have genuinely become a professional athlete or something else but mental illness has always got in the way affecting my self worth and focus so it was never long before i derailed or had a breakdown surely there are people who can relate after all mental illness is often the illness of intelligent people some say share your stories p s this isn t boasting i genuinely feel a lot of frustration knowing that i could have been happy and succeeding in life instead of causing people around me frustration and hurt i hope we all get better soon once and for all love to all yous,400,117,2444.002419
"I witnessed my girlfriend try to hang herself today, and saved her. I don’t really know how to process this.",pretty much title it s been a couple of hours but i feel numb and weird how do i process this i can t afford therapy and i don t really know if i need it i m mostly concerned with her safety right now and feel like that s all i should be focusing on edit she is on a 51 50 hold in the hospital now but fortunately isn t really injured psychically this has been a horrible 24 hours thank you for giving me an outlet to vent about this,395,34,1134.831713
"Half years ago, I begged myself to live for one month longer, Tomorrow, I am going to my first job interview. Guys, no matter how hard it is, we could all recover to a better self.",my depression tortured me for two years during my bottom time i went for the extremest approach now that half year had past and i am ready to step into the sophisticated world once again been preparing myself for quite some time and went over and over to harsh questions might be underway but i am not afraid this is an inspiration to all of you who are sufferring whose confidence and self esteem being crushed grinded rolled over and finally into pieces you cant even differenciate we all have bad times but there is always light ahead of us it will be my first time to put pomade on shirt covered and tie cuffed and walk into a room where people will talk to me judge me and compare myself with others i am feeling excited and although i am still not in the best shape in terms of the professional knowledge i am more than willing to give it a go in the end there are still people out there who would like to talk to me and maybe by a slight chance offer me an opportunity to work the world may look grim to you my dear friends but there is always light somewhere ahead you by all my heart i wish you a good day and a better tomorrow x200b edit just went for the interview seems pretty nice the interviewer indicated there might be a second interview incoming feels pretty good should there be any updates i will let yall know wish you all the best,395,27,1831.573576
Does anyone else just lay in bed all day,f18 within about the past 6 months i ve felt the most lazy and unmotivated i ve ever felt in my life i hate going to work it feels like the biggest chore of my life and i think about leaving as soon as i walk in when i get off work all i do is lay down and scroll on my phone for a bit before going to bed on my off days i lay down all day even if i know i have stuff i could be doing i don t have any hobbies or anything a day off for me literally consists of waking up masturbating taking a shower hygiene and then laying back down and scrolling on my phone til it s time for bed i used to be a really happy girl who enjoyed going out and doing things but i don t even enjoy being out anymore when i m at work out all i do is think about laying down it s so sad,401,132,402.8825462
