title,content,upvotes,comments,post_age
Thank you to the woman who rang me out at Target. You saved my life 😭❤️,i went to target and picked out birthday cards for my parents siblings and all my nieces and nephews for everyone s birthdays next year i was planning on killing myself after i filled them out they lady at target who rang me out asked why i was buying so many i have a big family i told her i was dying and they re for my family when i m gone i m sure she thought i had cancer or something but still she started to get emotional and started crying then she made me cry telling me all kinds of nice things and that my family loves me very much we ended up hugging each other sobbing after i collected myself in my car i decided to give it another shot just for her she was so sweet she indeed saved my life so thank you to the target employee you have no idea how far your kind words reached i am so grateful,2711,94,1208.784574
I made a suicide scale. Hoping it could help others.,suicide scale edit we have turned off notifications for this post and will no longer be replying to or reading comments for this post post replies have become a persistent and painful reminder that is interfering with our ability to grieve and move on furthermore we are not equipped to be suicide counselors if you want to continue talking here and sharing your struggles that is fine but we will not be participating in that conversation we will not be reading or responding at all for our own mental health and well being if you are suicidal please reach out to someone who can help you we are not those people reach out to a friend a family member or call a hotline here is the link to suicide hotlines by country please take care of yourselves and stay safe ariadne emmengard,1960,187,2128.998983
"Anyone else procrastinate going to sleep because they don’t want the next day to come, but then also get anxious about how many hours they have left before they need to get up?",this is always a struggle for me i just want the world to freeze at night time so i can have some peace,1754,116,1456.763624
I didnt kill myself!,today instead of a handful of pills i got up and put the pills away and ate 6 chicken taquitos i just wanted to celebrate it somewhere dont have anyone to celebrate it with me good job me,1574,160,1068.771356
Want an emotional support animal but can't have one? Get a stuffed animal.,i m a 35m a grown ass man that has been to iraq twice been beaten down in life more than i can count and i have a stuffed animal meet peanut he is my emotional support stuffed animal when i m alone and need someone to talk to he s there to listen when the ptsd nightmares kick up he s there for you to protect him from the bad when you get those bad thoughts of hurting yourself just look into his eyes and try to convince him way you think you need to hurt yourself be a grown ass man get a stuffie,1549,110,1648.257502
ahhhhhhhhhhhhhhhhhhhhhhhhhhhhhhhhhhhhhh,aaaaaaaaaaaaaaaaaaaaaaaaaaaaaaaaaaaaaaaaaahhhhhhhhhhhhhhhhhhhhhhhhhhhhhhhhhhhhhhhhhhhhhhhhhhhhhhhhhhhhhhhhhhhhhhhhhhhhhhhhhhhhhhhhhhhhhhhhhhhhhhhhhhhhhhhhhhhhhhhhhhhhhhhhhhhhhhhhhhhhhhhhaaaaaaaaaaaaaaaaaaaaaaaaaaaaaaaaaaaaaaaaaaaaaaaaaaaaaaaahhhhhhhhhhhhhhhhhhhhhhhhhhhhhhhhhhhhhhhhhhhhhhhhhhhhhhhhhhhhhhhhhhhhhhhhhhhhhhhhhhhhhhhhhhhhhhhhhhhhhhhhhhhhhhhhhhhhhhhhhhhhhhhhhhhhhhhhhhhhhhhhhhhhhhhhhhhhhhhhhhhhhhhhhhhhhhhh,1506,287,984.2372356
There is an Arabic saying and it goes like this:,you want to die then throw yourself into the sea and you ll see yourself fighting to survive you do not want to kill yourself rather you want to kill something inside of you,1490,66,1878.389365
To the person who deleted their post few minutes ago.,i don t really know what s going on with you and maybe most of the people around you can t feel it too you re not okay and things aren t alright i get it but ending your life doesn t have to be the only way i have a cynical perspective on most of the things in life so just bear with me if you give up your life either nobody will care or you ll hurt the one s that love you even though you don t come across them often try to handle things one at a time with a thought that you don t have anything to loose anyway and please don t forget there are people who care about you even if you don t know them this community cares about you share anything you want to we are here,1362,31,2020.185835
My doctor asked “Do you even want to get better?” in response to me saying I’m not in therapy because I can’t afford it,i m fuming she told me i need to tighten my belt and sacrifice other things like what food rent so i can go to therapy she a fucking well paid doctor told me a story about how was told she needed to see the chiropractor every week for 45 a session and while she felt that was too much she just had to move things around to make it work last time i was in therapy it cost me 150 a week with insurance the session i just had with her cost me 100 not to mention the cost of all my meds it s fucking insane how much all of this costs already am i supposed to find that amount under the couch cushions and what is the insinuation here because i m poor i deserve to suffer from mental illness you don t think i want to be in therapy absolutely unreal,1304,170,1512.290685
My wife has passed suddenly,i m 24 and have two children with my wife we was expecting our third when she started cramping it was an ectopic pregnancy which ruptured and she didn t make it i wasn t aloud to go to hospital with her because of covid and was trying to come to terms with losing the pregnancy when i got a phone call to come to hospital and given the news i can not believe she s gone my world has become so dark my daughter is five and is asking where her mummy is i can t begin to think what i m going to say to her my son is three and has development issues and is happily oblivious i m the stay at home dad my wife was the breadwinner i feel so guilty for worrying about money please someone help me i m so scared of the future i love my wife iv never been with anyone else we met at 15 became parents at 19 and married at 21 iv never thought of my life going any other direction than us 4 all moving forwards together she s everywhere i look everybody i see looks at me like i m an alien now i can t stand the look on people s faces when we go out my wife was very well known in my area from working at local corner shop and i haven t been able to avoid someone we know every single time iv left the house,1293,97,1479.399157
"I survived a school shooting, but now I can’t do anything",i m sure you ve seen it on the news oxford high school got shot up by some selfish asshole i was lucky enough to get into a classroom but i could hear the gunshots and the screaming i can t seem to do anything anymore i can t sleep can t eat don t have the motivation to get out of bed everything feels numb i don t know what to do why did i get to escape and live while 4 innocent people didn t i don t really know what to do and what i expect to gain from posting here but thank you edit i m going to therapy i will be picking up horse riding and starting art therapy in an effort to solidify it i went to see tate myre during visitation today he doesn t look like he did while alive but i was able to connect with a teacher and we will be hanging out and doing art things together thank you for your responses i also started playing a stupid little horse game called howrse that i was obsessed with as a kid kinda makes it easier to feel like a kid again,1286,99,1188.21227
I now understand why so many women hate men...,so basically i made a post about me being sexually abused from a young age and needing someone to tell my life story to i m a male and i ve gotten loads of dms from creepy dudes trying to get off by hearing about my sexual abuse history because they thought i was a woman like what the actual fuck i m so sorry it s like this for women i literally just want to talk to someone and it be an adult conversation,1191,100,17.72304579
my boyfriend k*lled himself in my apartment ,my boyfriend and i got into a bad fight where he ended up putting his hands on me i told him to get his things and leave my place i gave him 24 hours and his car was still there police came knocked on the door no answer i had the worst pit in my stomach a really bad feeling something wasn t right no sounds or movement at all not even a fuck off i called for a wellness check today and the officers found him in my bedroom i m diagnosed bipolar and adhd and i m having a really hard time and please dont say ur sorry because i dont want to say its ok because its not none of this is ok our last interaction was a fight i didnt answer his last attempts to reach me he put the latch on the door so i couldnt have stopped him even if i knew i wanted to be wrong so bad i dont want this to be real i cant do this,1189,193,161.6558583
"Does anyone else feel super motivated and ambitious late at night or around bedtime, and then waking up with absolutely none of those feelings?",i can t count how many 3am s i ve had where i thought tomorrow i m gonna start doing this or had some big epiphany that gives me a ton of courage to make a positive change and then i just don t feel those feelings the next morning it s been the case for years and years now i know exactly what i want to do and how happy those changes would make me but as soon as i wake up i just go back to wishing and fantasizing about them feeling like there s a brick wall between me and taking that first step it s so aggravating never being able to keep my own word and it s quite psychologically damaging,1179,75,1485.551784
Today I'm glad I didn't kill myself yesterday.,yesterday i was in a deep depression ready to end it all trying to resist the urge today i feel stable i ve been for a walk with a mental health group i ve listen to good music today i m glad i didnt kill myself yesterday edit honestly i m really overwhelmed by all the support from you lovely people i thought no one cared this is still hard for me to believe bless you all may you find light in the darkness strength when you feel weak and the courage to keep going 3 we re all in this together much love to you guys xx edit spelling mistakes,1145,115,1435.239423
I got out of bed today :),i got out of bed i showered i brushed my teeth i put on actual clothes i folded and put away the laundry that s been sitting on my bed for weeks and i m eating actual food before dinner time hopefully i can also wash the dishes call my family and maybe even start a load of laundry but at the very least i got out of bed today edit thank you so much for all your support guys 3 i m so grateful to have this little community to share with,1116,60,1646.116472
I Survived a Genocide But I Feel Nothing,i managed to evacuate from gaza leaving behind the rubble the bodies and the memories of the war zone you d think getting out would bring relief a sense of safety but all it brought me was emptiness i thought once i escaped i d be able to feel again to grieve for the lives lost for the people i knew but i feel nothing i m in a place far from the violence now surrounded by people who are living normal lives they go about their day complaining about trivial things traffic their jobs relationship problems and i just stare at them how do they not realize how absurd it all is i survived hell saw children torn apart in the streets watched families disappear overnight and now i m expected to care about small talk i don t even after i got out people wanted me to share my story to talk about the horrors i escaped but every time i do i feel detached like i m telling someone else s story i describe the destruction the bodies the screams but it feels like i m reading from a script i can tonnect to it anymore it s like i left my emotions back there buried under the rubble i ve lost all sense of empathy when i hear about someone dying even someone close it doesn t register i didn t cry when i found out a friend of mine didn t make it out i didn t care when i heard about others losing everything i go through the motions pretending to sympathize but inside it s just blank people think escaping the genocide means survival but it s not true part of me died there and the part that made me human never made it out now when i see images of what s still happening or hear about others struggles i can t bring myself to feel anything i walk past people begging for help and i feel no urge to stop i m broken in ways no one can see on the outside i m functioning i smile i work i talk to people but inside i m just as destroyed as the streets i left behind it s been 5 months,1100,118,175.0429879
My Dad shot himself today..,i don t know where else to put this but i need to get it out today my dad killed himself he had been battling depression for a long time today he got way too drunk he was a recovering alcoholic and got in to a big argument with my mom they were fighting on the front porch while i was in the kitchen making a bottle for my 8 mo son who was sleeping in his crib on the other side of the house after they were arguing my dad walked in to the house shut his bedroom door and shot himself in the head i was right outside the door when it happened and i can t get the sound out of my head luckily my son slept through the whole thing and was quickly taken out of the house by his father while i called 911 my eyes hurt but i can t sleep or close them with out everything replaying through my head i feel like my life is in pieces and i don t know what to do that s all i can really say if you need help please get it because of a horrible combination of alcohol guns and depression my son no longer has the grandpa that he so much adored and i am now with out a dad edit thank you all so much for all the sentiments i know it s strange to post something so personal to random people but hearing from all of you makes me feel less alone i guess i 100 agree about therapy and i am definitely no stranger to it and the help it gives sadly money is tight and my insurance is shit so if anyone has any resources to help me find a cheaper solution when it comes to therapy i would be very grateful,1066,79,1681.486171
Anyone else feeling very behind everyone their age. Like they're accomplishing all these things and I'm just here.,anyone relate,1045,141,1804.985766
"I was inches from committing suicide 6 months ago, today I signed a lease for the nicest apartments in my city. Hang in there.",long story short over the summer i was planning on driving my car over the edge of a cliff after i dropped some people off on vacation i was overwhelmed in life and saw no way out aside from ending it all felt like a disappointment because i dropped out of college worked as a personal trainer at a gym where i was taken advantage of and forced to work 16 17 hour days for pennies lived in some slummy apartments with no ac and barely had any grocery money i usually bummed pizza from local pizza shops at the end of the night when someone hadn t picked up a carry out order sometimes i d get something sometimes i d get told to fuck off got on average 3 hours of sleep aside from saturday nights mental health was at an all time low i made some changes that started with therapy after that i got a lucrative new sales job love the people i work with practice muay thai weekly work out every day and am in a much better place mentally if you think this post is about me rooting my own horn you re right i m damn proud of the progress i ve made whatever it is you re going through keep fighting keep waking up every day keep on keeping on,1043,36,1537.027398
I killed her.,good morning today is transgender day of remembrance few years ago i used my privilege of a passing rich trans women to give back i gave speeches helped change laws got my university to be one of the most lgbt friendly campuses i was on a roll for a few years one day in a grocery store parking lot a women stopped me and told me she has been to my speeches and following my story from me she said she got the courage to transition we talked for a little bit and went our separate ways she ended up being killed by her family i found out at transgender day of remembrance i ve been told many times that her death is not my fault but i blame my self i gave a false sense of security from my own life she is gone because of me after i learned this i stopped all activism i hid in my own life with the political climate i ve been asked to share my story again and i just keep thinking of her and don t think i can edit i have since this post brought it up in therapy and went to aa for my drinking life has gotten better i know now that i did nothing wrong i helped thousands and will continue again once i m better my self thank you for all the loving comments,1038,143,105.3743421
People who welcome you back with open arms after ghosting them during a severe depressive episode are like gold,self isolation is horrific and that is all,1029,51,1967.77602
"To anyone suicidal tonight, look up the Rappper NF. All he raps about is how to face mental health. He's saved my life many times.",he has been a true life safe for me edit i d recommend starting with mansion,1020,203,1572.8544
I'm SO Proud Of Myself,i just washed my hair for the first time in a week and a half and brushed my teeth for the first time in a month i m so proud right now i could scream i usually have no energy to even get out of bed i m so proud,995,112,879.854099
i’m one month clean of self harm :’),the title says it all,997,49,1635.298266
Depression does NOT mean feeling sad. Depression is a medical term for functioning below necessary levels,depression and it s synonym suppression are commonly used in medical treatment and diagnosis to indicate something is wrong and the affected system can t adequately contribute to the rest of the body so basically you can t think and act in a way that keeps up with your obligations so it s not just feeling sadness it s not laziness and it s not for the sake of gaining attention if some was experiencing respiratory depression would you say ok but have you tried breathing more no then cynics and doubters can fuck off ok i m done p s treatment helps depression it really does,992,83,2170.189215
"I don't have a lot of people in my life right now, but i wanted to share this: I chose life this morning. I chose my raggedy, rundown broken life. I chose me. And I think I chose well.",edit i love you all thank you,985,52,1993.367571
1 YEAR TODAY WITH NO ATTEMPT SUICIDE AND A MAJOR EPISODE,i am so happy today and never did i imagined i ll be as mentally stable as i am right now,945,59,1775.130222
I want to be hugged. I just want to be hugged.,i m going through a lot i want someone to hug me it s torture why can t i be normal,950,106,1558.358752
My husband been having sex with me in my sleep since 2014. I've had two ectopic pregnancies that result in both tube's being removed for two separate pregnancies. Due to the amount of miscarriages I've has sex is painful. I tell him no but he just does it anyway. Should I sue him ?,i just found out my husband has cheated on me since i can t please him due to my surgeries it was his fault we got pregnant without a doctors supervision monitoring my health i never knew i was pregnant until it was too late should i sue him for emotional damage physical harm to my body and my mental health i need counseling so bad but i m afraid he d go to jail should i just keep it in therapy i can always delete this account i just wanted to hear different points of view i swear i just want to d 3 than go file paperwork i wished i knew this wasn t normal i m so fucking lost i know people are asking why didn t i speak up it s cause i thought this was normal in any relationship i don t know why this post was locked but thank you to that one mom that want to give me a hug i desperately need it to everyone asking did i consent how can i if i m heavily sedated on sleeping meds some of you are the reason i didn t seek help because i didn t want to be judged about letting him do this to me for years i said sue because if i want to have a family with another man i would have to be artificially insiminated that cost money i would never have i truly thought all wives did this in their marriage so their husband can still be pleased i grew up in religious household that never hugged never said i love you never discussed sex nor relationship advice i ve had to learn everything first hand again i was 19 yrs old,946,213,256.6078606
"Does anyone else feel like they ""can't handle"" everyday life as well as everyone else?",sometimes i feel absolutely convinced that i m not cut out to handle a healthy work life balance like everyone else can i feel like my coworkers take on so much work compared to myself they have so many ongoing projects yet i can hardly handle the few that i do have i know part of this is an illusion because i don t see how they re really handling the stress behind the scenes another part of this is my own guilt thinking that i don t deserve my job or the money i make i always struggle with these feelings does anyone else think about this sort of thing way too much,935,114,1605.338891
My daughter is scaring me tonight. No idea how to help.,my daughter 10 very suddenly this evening said she feels like she s in a dream like she s not real like she s a ghost said she feels like she s going to die she doesn t look great almost like she s sick but she says she isn t sick except for feeling like she s going to die her pulse is normal i had her take a shower brushed her hair and she put on her jammies tucked her bed with beach sounds and told her to relax and picture being at the beach walked in a couple of minutes later and she s crying i m really worried but completely clueless my husband thinks it s her adhd adderall but this has never happened before she has been very moody and temperamental lately can anybody clue me in on possibly causes or where to start,928,243,452.8253375
I think that “13 reasons why” is a very bad way of “spreading awareness”,as the title suggests i think that 13rw is a very bad portrayal of mental health suicide depression etc and it shouldn t be promoted as a show that raises awareness when it s just harmful it portrays suicide as something beautiful and meaningful and not what it really is and the whole blame it on other people even though they tried to help me thing nope nope nope that s so toxic idk if i just feel that way because of my ptsd an older guy blamed me for his suicide attempt because i didn t help him enough even though i did everything i could and was only 13 but it s just not really how suicide should be portrayed in my opinion also the way they show flashbacks of hannah baker from when she was alive makes it seem like she s still alive in some way they reeeeally push this harmful suicide is something you choose as a weapon to hurt other people agenda when in reality suicide is often the exact opposite idk personally i really don t like that show and i think it s harmful i once opened up about my suicidal thoughts and depression to a friend and she was all like who made you feel that way like it was other people s fault like sure trauma and toxic relationships with people can worsen suicidal thoughts and depression but i just don t feel like the show portrayed it in a helpful way,928,109,1765.241194
"I know it sounds cliché, but it’s crazy how much a walk outside can clear your head and get you back to at least a neutral state, if not a positive one.",i know that the starting of something like a walk in the moment seems impossible but i just hope if you re feeling down and you see this that it can be that small nudge you need have a wonderful rest of your day,923,48,1521.969574
Cake saved my life,6 months ago i decided to go to a famous bridge in my country and jump but while driving there i saw a cake shop that i always wanted to try and i told myself why not eat some cakes before jumping make it a good last day so i ate 2 cakes and the cake guy was nice and it calmed me down so i didnt do it still alive,919,52,821.510187
My boyfriend undressed me without asking. It’s not what you think though.,i am usually the most positive motivated outgoing person ever but with covid 19 affecting every aspect of my life it wasn t a surprise i became deeply depressed i had been trapped in my apartment for months with no job money or motivation my mentality started shifting to something more cynical as well one night in particular though my boyfriend helped catalyze me getting better it was insanely difficult to get out of bed sure i d get up maybe for an occasional snack or a quick bathroom break but i was just stuck mentally and physically and in this case i hadn t left my mattress for days i wasn t okay at all then one day out of the blue my boyfriend went into my closet and grabbed me one of his t shirts my underwear and my shorts he propped me up and undressed then dressed me while my eyes swelled up he didn t even ask he just did it every time i think about that moment i tear up because it was the most intimate and sweetest thing anyone has ever done for me i really am so lucky to have such a caring man in my life i can t wait to marry him some day our relationship is him doing the most selfless acts of love for me and even though he might not think much of his actions they mean the world to me and for an update on my mental i am doing incredibly better don t want to go too in depth because he deserves all the love on this post thank you for reading,909,44,1745.591877
