title,content,upvotes,comments,post_age
I ate and didn't purge for the first time in 2 weeks. So happy!,i have purging disorder which is purging but no binging like half bulimia and half anorexia for half a year already after my high school graduation my depression and anorexia onset were so bad i purged every single thing i ate today i did a long workout and then ate a light meal it s been so long since i last ate and actually kept food in my stomach i m so happy about this even though my workout burnt way more calories than i ate i m still proud of this little achievement the only concern i have now is that i have partially starved myself for quite a long time so my body will kind of store what i ate as fat because it doesn t know when the next starvation will come now i m trying to purge less eat a little and workout a lot thank you for reading if you need someone to talk about depression eating disorders of all kinds and anxiety please feel free to message me edit thank you for all positive and supportive comments i kinda feel bad because i purged my dinner after having posted this but i promise myself that i will have a meal without purging every day,349,18,2463.10533
I’m so scared of men,nothing seriously dangerous with a man has ever happened besides small unfortunately too common acts of sa infact i have actually been gang beaten by a group of drunk females in stead but i m so terrified of men that i literally flinch if one walks past me from behind etc i don t hate all men i m just terrified of them and it really impacts my dating life as i m a straight female and simply just being alone with males is this rational how can i get over this fear edit what i ve taken from these answers is the fear statistically speaking is understandable i should stay aware of these situations and make informed safe decisions but seek therapy to overcome the extreme fear of the simplest person walking past me,349,88,492.5240218
It was my birthday yesterday and now I realise how unimportant I am to everyone,i turned 28 yesterday and spent the day alone as usual i hate birthdays it just reminds me how worthless i feel i didn t get a text or message from anybody even from people i m close too i have no friends never had a relationship and don t think ever will i m close to nobody i ve never felt a bound with anyone even family i ve always just felt like a burden and inconvenience i just feel so utterly insignificant in peoples life so i spent my birthday alone and got drunk alone because that s all that seems to be in my future shit like this just makes me want to give up because it just doesn t get better edit your all wild thank you so much for reaching out and making me cry thanks for the happy birthdays its definitely the most birthday wishes i ve ever gotten and i really appreciate all you,350,121,1313.190932
"people only care about mental illnesses that are cute, quiet, and make it easy to pity you. do you agree?",when my only diagnosis was depression and anxiety i was easily pitied and white knighted either by boys who thought being suicidal and helpless was sexy or with half assed attempts from mental health workers volunteers well my bpd symptoms got worse instead of sulking when i am feeling self doubt or low self esteem i immediately project and lash out this comes from a place of extreme pain and years of trauma but because it is a stark contrast to the inwardness of depression i rarely get the same attitude i did when i didn t mention bpd symptoms i see it constantly no regard for anger as a mental health symptom in support communities pointing fingers and calling the aggressive psychopathic etc people will advocate when you re all cute and quiet and tiny and not making any noise once your mental illness becomes external and your pain manifests into outbursts and aggression it s completely dismissed and the person is disregarded and abandoned this is why i am so afraid of having bpd but that s beside the point i was wondering if you guys had any experience with this phenomenon,346,57,1322.123107
I can't stop cringing about myself and it's hurting me,i can t stop being assaulted by memories of embarassing moments or times i acted inappropriately these can be events from a few days ago to decades they hit me hard to the point where i physically react and shout swear words i sometimes look like a maniac walking down the street and i m sure my flatmates are a bit weirded out by it it has been happening for a few years but recently they just keep coming and they almost feel like an electric shock this is causing me a lot of stress and while i never seriously considered suicide after i get a few of these episodes i start fantasising about what would happen if i just ended it i know it s not a good sign is this common and is there anything i can do about it i don t think i have tourette s syndrome as i can sort of control my reactions not the thoughts when i m surrounded with people i know,350,63,1776.184554
Haven't showered in weeks,i would never admit this irl but i can t remember the last time i showered it was either 2 or 3 weeks ago i know it s gross usually when i m not doing great i am motivated to have at least 1 shower a week because of church but there s no church atm i ve been intending to shower but i just haven t gotten round to it i usually sleep a lot eat breakfast go back to lie in my bed and watch videos occasionally sit up in bed and go on my laptop eat lunch eat dinner sleep repeat tomorrow i m actually going to shower and wash my super greasy hair because i m leaving the house for the first time in over a month me and my dad are going cycling for our hour of daily exercise i might even shave which would make me feel more comfortable wearing summery clothes inevitable edit thanks everyone for commenting sadly i don t think i can reply to everyone but i have read and appreciate all the responses and i m glad if my post has helped anyone else struggling i have now had a shower woo woo and a half assed shave so yippee for patchy legs lol again thank you everyone i love how supportive and non judgemental this community is,352,74,1782.999496
I wanted to say a massive “THANK YOU” for all the support you gave me when I lost my mind a few days ago. You immediately responded to my panicky post with great advice. I accidentally took twice my lithium dose and forgot everything. Your help calm me and my mum and got us through it,just thank you for being an awesome community a few days ago i accidentally took too much lithium and i totally forgot who i was and i freaked out i initially didn t know what had caused it or how long it would last you were really a great support and comfort and got us through it i hope i can support others and give back keep being awesome edit true to form i ve had lovely messages you guys thanks so much can i move in with you i ve stopped reading the messages for now after the first one triggered me about stuff at the moment it s annoying but i ve learned the hard way that if i give things time they go quicker if you pick it it won t heal,346,11,1317.600897
For the first time in 20 years...,for the first time in 20 years i am hopeful for the future and not completely terrified of being alive,344,27,1393.722228
Alone on birthday.,so about 5 years ago i lost both my mom and my dad my father i lost to cancer and my mother was killed in a motorcycle accident today i turn 25 and i m having an incredibly hard time enjoying today being by myself and being the only one that knows it s even my birthday i go through this same thing every big holiday are there any orphans on here with advice on how to still enjoy getting through life without the guidance of mom or dad,345,64,1450.289913
is my dad slapping my ass sexual assault,for context im 16 years old my dad started playfully slapping my ass a while ago and at first it was just a silly joke kind of thing between us but then i started getting uncomfortable because he would also say stuff like my ass was too small while touching it he said that guys liked girls with big butts and that i need to put on some weight i kindly asked him to stop slapping my ass shortly after that and he got so butthurt he said that he just wanted us to be close and that it was sad how he couldn t even joke with his own daughter and didn t stop i made it clear to him that i didn t like it whenever he layed his hands on my ass and my mom would usually be there too but said nothing one day i started crying after he did it again and that made him stop now whenever i bring it up and be like hey dad that wasn t very nice of you he starts gaslighting me and says that thats not what happened and that i m making it up this kinda turned into a vent thing lol im safe now but i just want to know if that counts as sexual assault edit please stop telling me to report him he didn t molest me yes it might have escalated but it did not i m safe now i love my dad and seeing people call him a pedo doesn t really help,345,82,1242.268119
I'm proud of myself,hello everyone long time lurker here mainly due to being scared to post but i did something i have been wanting to do for the last two years and i m proud it may not seem like much but i cleaned up my room and even rearranged it my room has been my prison as well as my shelter for the last two years due to a divorce and a life long battle with depression i love how my rooms is now and once i m finished with the rest of the trash i ll be even happier always be proud of the little victories for those are the ones that keep you going,345,23,1649.589601
Am I the only one whose mental state seems to have improved from being isolated for this long?,i feel like being under quarantine has ironically actually helped me out a lot my family has a long history of depression and in the past few years i started to get my first touches of it over time it progressively got worse until recently idk what it is but after being isolated for this long i feel fantastic better than i have in a very long time has anyone else noticed this all i see are people talking about how horrible their lives are in quarantine and how much they want it to end and i m not gonna lie part of me doesn t want it to i know it has to eventually but part of me really really doesn t want it to end i was just curious what other people s experiences were thanks,348,54,1739.705955
My 13yo son’s school project about battling depression,my son needed to do a multimedia piece on a social justice topic for his grade eight class he chose to do an animated feature on mental health specifically depression his film is called overcoming the darkness and i think it s amazing i hope it helps someone edit there s a small strobe effect at one point so if you re sensitive to that sort of thing be aware,351,42,2182.353374
Toxic people are a thing,sorry idk how to share any other way edit i m sorry also i don t know if i can or how to change the title to something more accurate i chose the words poorly i mostly meant to say that you should be aware of things others say to you and you say to others because some phrasing differences might make a huge impact on how the words effect you or others some might be helpful while others can be indicative of a toxic relationship or a toxic person i m sorry if you took the title wrong and if anyone knows if how i can change the title please let me know i m still new to this reddit thing,348,45,2219.168628
"Am I the only one who enjoys nothing and views life as an empty, pointless path towards death anyways?",ever since my other parent ended up dying i ve turned into a toxically pessimistic piece of shit to the point the discussion of my views has broken friendships life feels like an empty walk through a barren valley to death feels like there s absolutely nothing to work towards nobody to impress nobody to be proud of me nobody to be happy or upset of who i turned into it s just me hoping to find my own meaning in life although there is none absolutely nothing at all can bring a smile to my face besides driving so fast and dumb i realize i almost died then almost died again and again it goes so so much deeper much more than i would ever tell reddit or a psychiatrist but leaving it as simple as this please tell me i m not alone i can t be the only one who feels like their better meaning would be to just die is there a way to break free or is this who i m destined to be for the next 70 years of my life,343,72,1437.393651
A Letter To Those Wanting To Understand Their Loved Ones With Mental Illness,a letter to those wanting to understand their loved ones with mental illness if you are reading this as one of many who doesn t understand what it s like to deal with mental illness i am very happy you don t experience firsthand what i and so many others have to experience on a daily basis because i would not wish this pain on my worst enemy i am so happy you don t have to experience feeling that no one in your life truly loves or cares about you despite them reassuring you that they do on almost a daily basis i am so happy you haven t had to answer any of the further questions that follow do you feel anxious or depressed when visiting the doctor s office i am so happy you have never thought the world is better without you in it if you have never had to leave a party because of a sudden wave of anxiety or sadness i really hope it stays that way if you are able to get out of bed without feeling nauseous with anxiety or the weight of depression appreciate it every single day don t ever take it for granted don t let a day go by without appreciating how beautiful life is and can be because many of us myself included aren t always able to see that beauty no matter how hard we try while mental illness is something that is so wrongfully romanticized in the movies it is very ugly in real life mental illness is not quirky or poetic like society makes it seem on social media being mentally ill isn t aesthetic worthy mascara filled tears with sad music in the background mental illness is barely being able to keep up basic personal hygiene because it feels almost physically impossible to get out of bed mental illness makes the world seem pointless so when a loved one approaches you seeking comfort or a listening ear please don t automatically assume it is an annoying cry for attention because i promise you that assumption is our worst fear the last thing we wish for is to be a burden on the ones we love isn t it ironic that even when we are struggling our first thought is to not make our loved ones uncomfortable and when we cancel plans or fail to stay around the entirety of a social outing don t take it personally trust me we already beat ourselves up for it enough already because we finally put ourselves first for once even though that is what we should ve been doing all along when we isolate ourselves from you and push you away don t think it is us being rude we are just trying to do what we can to feel like we aren t dragging you down with us please do not blame us for the cards we got dealt we deal with them the best we are able to even if it means pushing loved ones away to avoid getting hurt most of all see mental illness as you would any broken bone or any physical sickness it hurts just as bad and is equally out of our control so while we don t wish you would first handedly understand we want you to be patient and understand the best you are able to we are fighting an invisible illness that we aren t always sure we can beat however even with this ongoing battle to stay afloat in our own minds filled with endless thoughts not every single day is a bad one in fact we go through periods of time where everything feels alright again for a while so when those good days finally come around we appreciate it and never take it for granted because to those who struggle with mental illness it is a privilege to feel the true happiness that everyone deserves to feel every day sincerely the mentally ill,341,34,1567.580712
We are asking Congress to take action on the mental health crisis in America.,hey guys we are a group of high school students who are committed to solving the mental health issues of today through awareness and policy the mental health crisis is one of the most prevalent issues facing the american population today not only the youth we are also compiling a list of candidate endorsements who are pledging to focus on mental health reform once they are inaugurated in fact 1 in 5 american adults experience some form of mental illness each year national alliance on mental illness while only 41 receive proper treatment mental health first aid this is unacceptable and we demand action now we ve witnessed these problems in our own schools and neighborhoods and we believe it is time for us as a country to step up and pass bold solutions to protect everyday people we are also asking you to sign and share our petition to ask congress and the president to commit to comprehensive mental health reform to ensure that everyone has access to quality mental health care thank you edit thanks for the overwhelming support we would never have dreamt of getting almost 350 upvotes in only one day we have just started a gofundme in order to raise money to increase the awareness of this crisis on more platforms such as instagram twitter and google the link can be found at have a great day,344,30,1873.997147
My 9-year-old is madly obsessed with me. Any advice?,x200b at first it seemed very cute and sweet like a crush sort of thing through this past few years it has been escalating to a point where it is creepy and i fear for her mental health and future safety i m telling this story as a way of trying to get some opinions let s call her cindy she is a daughter of a cousin of mine who i am not that close to but we still get along pretty well i m going to share some anecdotes so you all can see what i mean we come from a family where reunions and parties are common and happen at least once a month so we all see each other frequently cindy always wants to be around me she wants me to play with her and hold her every minute of every single reunion whenever i dare to hug say hi or even acknowledge any other member of the family especially when it comes to younger females of the family she would get upset and throw a tantrum running away onto the streets whenever the family starts dancing outside which is pretty often lol cindy makes me pick her up and dance with her i can only dance with her no other female is allowed near me i can t even put her down to go the bathroom or have a drink and whenever i did put her down well temper tantrum time she once smacked her youngest sister mia 2 year old so hard it almost knocked her out just because she was walking around the house spotted me smiled and wanted to get close to say hi anytime another female of the family would bring me something to eat or drink she would make me give it back or throw it away so she could go and bring me whatever i had just been given one time i did not show up to one of those reunions because some other plan that sounded more fun came around dick move i know cindy asked everyone a thousand times where i was and why i wasn t showing up eventually they got tired of her and decided to call me i explained that i was hanging out with some friends when they told her about this she got furious grabbed a stone and threw it at the nearest car breaking one of the windows she then locked herself up inside one of the rooms 3 or 4 times a week cindy s mom would call me telling me cindy wanted me to come over so i could help her with her homework sometimes her other sister 8 year old would ask for my help too causing cindy to flip out throw things at her and call her names whenever i refused the invitation to help cindy with her hw she would start ripping her notebooks and textbooks or pouring water on them she then started to force her parents to bring her to my place every other day even if it was for a short visit this one time they left her with me because they needed someone to watch her to do some errands cindy was in my room and i left for a couple of minutes to get her some snacks when i came back i found her going thru my clothes she started crying and said she wanted to steal one of my t shirts so she could remember me with it i thought it was kind weird but cute in a way i told her she could have one of her choosing each time she came over after that she demanded a new shirt to take i told her i couldn t give her anymore shirts because i don t have many which is true every time she would come we would have the exact same conversation until without me noticing she took pretty much all my shirts and stuffed them inside her backpack her mother had to come back the next day and give them back i used to play along and not say much to her or her mother because like i said i thought it just was a crush or just a little girl overly attached to an older family member it escalated gradually to a point which i didn t know what to do and besides i m really not into confrontation so i didn t want to cause any trouble last time i saw cindy was this past weekend another family reunion but this time i brought my new girlfriend with me she was my best friend for 6 years but i escaped the friendzone haha cindy was using crutches because she had gotten injured doing something or other while at school so she couldn t follow me around like she usually does obviously she got furious when she met my girlfriend but she didn t say much she sat right between us and didn t let us kiss hug or dance laura my gf went to grab a drink for both of us and immediately cindy started moving around so she was occupying the rest of the sofa when laura came back she refused to move and let her sit i lost my patience even when i lose my patience i m still pretty chill and told her that she was being mean to my gf and that meant she was also being mean to me i also told her we me and laura would have to leave if she kept it up cindy lost it she started screaming and kicking she called laura every name in the book and finished by saying that if we continued being together she would shoot us both with his father s gun turns out my cousin is not very bright and it took her this long to realize something might be wrong with her daughter my cousin pulled me aside and i told her everything everything i just told you and a lot more i advised her to seek help for cindy and told her it was best if i stayed away for a while im really worried about cindy and her wellbeing so please if anyone has gone thru something similar or if some of you understand what is going on and what can i do to help i would gladly listen thank you ps english is not my first language so sorry if some of the writing is gibberish,341,68,2044.673119
Feeling weird about some stuff my mom did to me and I just want answers.,so recently i was thinking about some things my mom has done while i was younger i m 17f now she would make me shower with her from 10 13 even though i was showering by myself during this time and she would wash my private parts with her hands not a wash cloth i felt weird about it but didn t say anything i would also lay down in the bed with her and she would start touching my inner thighs but nothing further also she would make me and my brothers rub her feet but she would make weird moaning noises and said that she had a foot fetish she also made a weird joke about how she would show me what it s like to get molested and tried taking my clothes off jokingly i remember being very uncomfortable when i was around 14 i told her that i had a boyfriend and she slammed me on the ground and made me tell her information about him and would not let me go also last month i was dealing with issues with constipation and she bought me this laxative device that you have to stick in your butt to do i have trauma from that era specifically because i was raped in july and she knows that she even knows that specific area is just a source of trauma but she made me take off my pants and kept insisting that she put it in her for me i kept saying no and that i would do it myself but she kept pushing me i literally was screaming no and she said that my stepdad does it for her all the time eventually i started crying and having ptsd flashbacks so she eventually backed off and apologized i don t know what to make of any of this my stepdad hasn t done anything weird but he did make a weird comment about my boobs being out when i was wearing a shirt i just want help and someone s thoughts,344,69,488.2138135
Small win,i showered for the first time in five days today i hadn t even realized how bad i had gotten but this small victory is lifting my spirits,339,22,2099.84077
I did things today.,i bathed washed my hair moisturized my face and went outside it s not much but even that low level of self care has been hard for me over the last few months it felt really nice to feel more human,339,35,2201.695318
