title,content,upvotes,comments,post_age
My suicidal thoughts and depression.,if you re reading this can you please upvote it so others can see thanks for reading this as well it just helps me i guess my names jack i m 15 years old bi not come out to anyone have dandruff acne pretty fucking ugly all things considered and severe anxiety and depression i was living great until last june at the time i had 2 best mates who i ll refer to as m funny kind but not entirely good to talk about mental health and touchy feelings and k kindest person ever used to be able to speak about anything to but mentally isn t great k had severe mental health issues and was not listening to anybodys advice about seeking help eventually i asked m if i should confront her about it he agreed i did it because my other friend who i ll refer to as j narsasistic arrogant but has a soft side occasionally had been telling me for months she was an attention seeker i figured she d take it alright but i was wrong she trusted me more than anyone her words and it was the worst thing anyone had apparently told her it bothered me alot and i kept trying to make ammends because i felt terrible i was relatively stable in the grand scheme tho 2 months pass and august aka summer holidays hits worst month and a half ever j had somehow convinced m i was basically a backstabbing lying piece of shit and essentially the worst person ever we argued back and forth for a while we fell out hard to say the least it broke my heart losing both m and k i guess j in such a short time and the misery started to sink in hope wasn t lost i had 2 friends left b kind nice to talk with quiet and z think j but a geek gamer and a textbook bully i had a plan to get m k and j face to face all previous stuff was done by text z was on holiday so i tried asking b to get them together he said to wait until school but i insisted as k didn t go to our school i accepted tho however according to what i ve been told b lied i think and told z i had manipulated him into trying to get them all together z bullied the shit out of me this is where i think my depression sunk in i couldn t think properly lashed out in anger out everyone was bored of gaming etc moral of the story i wanted to put a bullet in my head september hit and school started year 10 depressed anxious and suicidal my studies went down and thus my grades then my parents split it sucked my father isn t exactly great he can be abusiveish at times everything started to get worse and i ran away several times and dragged a knife across my arm alot i started to sit in the library for most of the day and still did until corona got sent work and it definitely helped with my anxiety as i was bullied and a laughing stock in year 9 pretty badly so being out of lessons was alright i started seeing the school councillor which helped to have someone to talk to in december the school had no choice but to take me to arrow park hospital as i had massive scars across my chest from self harm i stayed overnight and my parents ended up kinda talking things out i had to go to therapy to say the least i was still on the edge of suicide started the 8 week course this january and it was alright helped keep me positive j and z made me want to die more as they constantly reminded me of what i am a monster told me i was worthless should just do it and brought up my instagram stories i used to post on them suicidal stuff as a cry for help but was just accused of attention seeking worse too throughout the next 2 months i still stayed mostly the same suicidal depressed anxious most importantly lonely me and m eventually worked things out because i actually put the effort in a lot over several months begging him and k to help me and how sorry i was they didn t really want to be my friend k and i are currently on ok terms i think imma take it slow with her m and i talk a lot now but i still feel lonely have to hide how i feel now don t really have anyone to talk about this stuff to anymore at least i still hate my life want to die does make me wonder if i m actually really liked by anyone but how would i describe myself gamer mk11 overwatch paladins and smash want to do well but knows i can t socially awkward on 1 to 1s try to be funny nice to people who i care for and are nice to me would die for my closest friends but i m lonely ultimately depressed can t ride a bike swim fear of driving etc i don t know if anyone will make it this far but if you are and if you are my age thank you i don t know what you really can reply with but please upvote as it just helps i guess my self esteem,499,84,1749.867982
Movies make personality disorders look quirky and fun. But I'm miserable not knowing who I'm going to be tomorrow.,blew a job interview this week last week i did the first interview i was confident and sharp this week i did the second interview i was neurotic and stuttering it s hard not knowing who i ll be tomorrow i try my best but people don t understand and movies make personality disorders look so trendy and quirky fun even but i m miserable i m 35 and i know my personality disorder is going to lead me further down a dark path of self harm people won t put up with a middle aged man who acts one way today another way tomorrow,499,27,1454.868167
Sometimes I just want to drive off of the road and wreck my car so people will come to my bedside and tell me they're happy im alive.,i just want to be taken care of,500,51,1686.030875
"Does anyone else just have that feeling that they want to go home, when they’re already home?",i don t know how to explain it all that well like the feeling you had as a child when you were at the grocery store and wanted to go home it s that same feeling but slightly less intense and now as an adult when sitting at home,495,66,1463.648688
Recovering from depression really feels like I’m trying to stay “sober”,first i ve never had to deal with substance abuse and if what i saying is insensitive please let me know it really does feel like what i imagine abstaining from alcohol or drugs feels like but instead of that your abstaining from bad choices for example can t stay out with friends because if i don t have a regular sleep routine it will drastically effect my mood can t drink a lot of caffeine because it will effect my sleep schedule and my mood can t drink alcohol because with messes with my medication and my mood can t think those negative thoughts or otherwise i will spiral can t stay in bed all morning or otherwise you ll stay in bed all day or even several days i have to perform basic hygiene even though it is really hard today or else you ll feel ten times worse was wondering if anyone else felt like this edit oh wow i did not expect this to get any comments or votes i have suffered depression for over a decade staring in my teen years i did not get the help that i needed until recently and therefore developed many bad habits to try and cope with it but for the past few months i ve been working on getting better but then i spiraled really bad during the holidays because i strayed from my rigid routine so now i m trying to start all over again but it really helps to know that other people feel this way too thanks for the awards and comments,496,22,1510.787403
"If you are suffering from depression or suicidal thoughts, this the wisdom I’ve gathered since my suicide attempt a decade ago.",first and foremost you need some rest i would say that 10 10 times when i have suicidal ideation it s also when i am over tired or over worked secondly there are people in your life that genuinely care enough to force you into help i know it s scary to reach out to them and admit that you are having a hard time alone but i whole heartedly recommend it i would not be alive to type this if it weren t for the wonderful people in my support network one method my friend and i came up with is that i can kill myself i just have to get his permission first this gives me the benefit of having the option but also puts the social pressure on me to never do it i know you might think no one gives a shit but the same people who would be devastated if you died would probably prefer to help you out before it gets to that point there is something socially validating about suicide in the brain of the suicidal it feels easier than to admit you are having a hard time you feel like people will take what you are going through seriously but plain and simple you will not be around to enjoy that validation because you will be dead and all the people who would have helped you will be asking what they could have done instead of leaving the people you love on this earth with the trauma of dealing with your death please reach out to them lastly what you have gone through is not easy you may feel exhausted defeated or even angry at others self reflection might be productive but you are right to feel angry at how they treated you what you do with that anger is your responsibility now and it seems like you are just letting it eat away at you maybe there is some way to can transfer that anger into productivity or artistic expression who knows you have real problems they suck you re totally right to feel that way you should feel no blame that shitty things happen to you but these problems are still your responsibility and there are people out there who can help again i would not be alive today if it wasn t for the friend i mentioned above and a wonderful therapist who came in at the right time you may not have luck the first few times my first therapist sent me into a mental breakdown but i promise you that you will find the right fit if you keep trying focus on the problems that you can solve i think about the serenity prayer they say in aa every day grant me the serenity to accept the things i cannot change the courage to change the things i can and the wisdom to know the difference there are many issues in your life you may not have control over but there are some that you do focus on those try to define them as precisely as possible don t say everybody hates me say everybody hates me when i ______ the first is a cry of defeat the second gives you a concrete area of yourself that you can improve i always tell my friend if you are going to hate yourself at least be more specific there is so much in life worth living for a beautiful sunrise your daughter s graduation some day hell even if it s just a new season of a tv show you love the future is a mystery and that s a good thing it means that everything is going to change if things are good they are going to get worse but that also means if things are bad they are going to get better take solace in that during the bad times and prepare yourself what things feel like they are going too well don t hesitate to dm me if there is anything i can help you with we re all on this crazy ride together god bless also posted on r male mental health edit thank you to everyone who shared their stories or sent their kind words i hope that this post does not glamorize suicide attempts in any way yes i tried but that doesn t delegitimize the suffering of someone who hasn t just because you haven t attempted doesn t make your situation any less valid or serious compared to anyone else s remember my words above a suicidal persons warped sense of reality tells them that suicide is a better option than reaching out for help it is not ever many of you have reached out to me in a pm and i thank you for reaching out to someone i am always a friend in need to someone but i am not a professional there are real professionals out there making a difference just waiting to be the change you need in your life remember the best thing you can do is reach out if you are considering suicide please call the suicide hotline i cannot stress this service enough it has saved the lives of people close to me 800 273 8255,494,81,2180.375331
"Please stop posting your plans to kill yourself, it literally says in the description of this community to do it in r/suicidewatch",not to mention no one seems to use any warnings or anything tired of seeing this shit,493,75,930.8658056
Did your parent ever say “stop crying before i give you something to cry about”?,edit i should say children under 6 or 7 so many parents mine included said this to me as a child i think it s so harmful to children because they are tiny humans with emotions that they don t understand how to control and my personal opinion is that it is a parent s responsibility to teach their child how to navigate negative emotions does anyone feel this way as well lets talk about it,498,193,1449.213456
"I like to think, whenever you ""pour one out"" for a friend or family member who has passed, in whatever afterlife you picture them in, a cup appears in front of them and they get to drink whatever you poured out for them.",i ll start by saying i m agnostic and i dont really believe in absolutes because no one can see the future no one really knows whats happening in someone else s head and you can t predict who will pull through whatever or who will be lost to whatever and there s no way to really know what happens when we die in all honesty that thought brings me comfort i dont think im a bad person sure ive done shitty things im human like you i assume but this mindset is what has gotten me through some rough shit 2019 is my worst year to date august 24 a good friend who i really looked up to committed suicide i credit him to be a big part in preventing my own suicide then in november a great uncle and a high school classmate both i was very fond of passed within a couple days of each other then december 10 my grandma passed after a stroke the week prior her husband my grandpa passed in may 2020 that was a bad time as you can imagine i had never lost anyone i was ever close to before then my friends suicide being the big thing im still struggling with today but whenever i have a beer or some liquor i pour one out in his their name i like to imagine my friend in valhalla as of all the afterlives that i know of thats where he belongs as he is a fucking legend he lost his battle with depression but he fought fucking hard i still laugh and smile at the thought of him in any afterlife yelling at whoever is in charge because they don t understand the rules of whatever afterlife pathfinder game he s running and i like to think that wherever he my grandparents my old high school buddy and my great uncle may be when i pour one out a beautiful mug full of that liquid is presented to them which that thought is made better by the fact that often times im drinking really shitty cheap booze and they look up from wherever they are and are just kinda what the fuck you pour one out in mourning and im stuck with your shitty 1 dollar beer i dont know just a thought that may help someone in mourning hang in there stranger no matter how shitty life gets it will always get better and despite the fact that life will get shitty again at some point it will get better again hang in there,498,36,1514.734012
New job! Still homeless but I got a new job! Mental health is on the uptick!,i am so fucking excited story time before covid hit i was a leasing agent for a large canadian reit i was important i was valued i was paid very well i had everything i wanted i was fortunate enough to be sent to calgary to launch one of the largest private student housing projects in canadian history was a big big deal in the industry then covid came along and decimated the student housing industry 50 of our clients were international and of the remaining 50 being domestic only a small fraction of those were locally domestic you can imagine what losing 90 of your paying clients can do for a project i lost my job and came home defeated my mental health suffered my physical health suffered my relationship suffered i wasn t working i wasn t a partner anymore my girl left me in dec things were hard i was alone i m very much an introvert the only people i talk to are people via reddit or random women on dating apps there s nobody i could call to come over and hang out with nobody i could call if i was having a dark moment and there were many dark moments let me tell you winter blues is a thing i m a huge believer in that i was living in a basement apartment that my ex and i shared before she left i was so immobile emotionally and physically that for 5 months after she left i couldn t bring myself to removing anything she left behind she took the cats but the cat food sat in its dish for months her clothes still hung in the closet the way she left them every day was a dark dank lonely sad existence i knew i needed a change i had to change my outlook my direction my goals i started talking to people on dating apps i had no intention of seeing anyone i just needed to talk to people again that helped i also started being more active on reddit that helped too i like talking with people i like giving advice small uptick in mental health after this then the sun started coming out the grey dirty snow started going away it was the end of april forced myself to go outside even for a minute even for that very short walk to get milk instead of ordering it i went and got it small uptick in mental health after this i got closure with my ex finally small uptick here i needed something drastic though so voluntary homelessness i left my apartment i rented a room and when that went to shit i started living out of my car waking up in the bush next to a river down by the ocean did wonders not caring or worrying about anything nothing at all just being entirely selfish in my needs my mental health huge uptick i started smiling again i started feeling better about everything x200b was going to spend the entire summer living outta my car then one random night i applied for a building manager job its become so much more than that i was just given a job offer for a leasing agent role and a building manager role for a smaller reit but this position will require me to be very mobile i could be driving 3hrs away to one of our buildings i will never sit in an office the company car is my office its going to be a couple weeks before i can afford an apartment or i might just continue to live out of my car which may be tough because i ll also have a company car so we ll see what happens there but huge huge uptick motivation is high excitement is high self worth is high i m valued again they were hugely impressed with my skill set and its feels so damn good to be valued again i wanted to share this because i ve said to 100s of people on this very same sub that things can change but you need to be the catalyst for that change nobody is going to come along and place change at your feet you are responsible for everything that happens in your life regardless of what has happened in your life wake up tomorrow forge forward make a small change in your life and allow it to snowball things are on an uptick now but things dont get any easier with this uptick comes a tremendous amount of responsibility people are invested in me this motivates me i ll wake up tomorrow for my first day with a tremendous amount of energy and enthusiasm but will have to know and understand that a downtick can come at anytime i ll deal with those when they come i m not going to worry about something that hasn t happened yet forward progress be the catalyst for change and personal growth have your pity party be sad have regret but you gotta get over it you gotta find closure and move on because the world will continue to spin without you may aswell spin with it amirite,499,18,1358.620806
I dont want to kill myself but I don't want to be alive either. It feels like I'm being forced to suffer and the only things that make me happy are just distractions from getting better.,i fucking hate myself and everyone around me i hate my mother my dad and my brother i hate my best friend i hate my fucked up body and being alive is just morbid and disgusting my mum is refusing to take proper care of my pets which i now have 5 of because she wanted more and will probably try to get more i do the best i can but she still fucking overfeeds them so my two new kittens are going to be overweight and sick like the rest of my animals if i show any sign of disagreement which is basically fucking impossible because she will literally say look how fat theyre getting isnt it cute and i cant help but look miserable or telling her that what shes doing is wrong she will threaten to kick me out to move in with my dad which she has done multiple times before i cant stay there because the whole house is covered in mould and i have breathing issues because ive been smoking cigarettes weed heroin pills suboxone and tons of other crap since i was 12 years old my breathing is so fucked i am constantly aware of my lungs and just breathing fresh air makes me feel so disgusted to be alive i have an infection in my mouth and another in my sinus which i basically have permanently because of the fucked up structure of my face im not taking drugs anymore but i still smoke a cigarette every few days and i am so guilty because no matter how hard i seem to try i cant even take care of myself i live in fucking sydney where the house and rent prices are so fucked even if could find a trade or work i wouldnt be able to move out the only person i had that understood and was there with me through all this shit was raped and murdered almost two years he was my best fucking friend the only person my age that i had been friends with in 6 years my other best and only friend is addicted to fucking heroin and has aspergers so he just jumps to conclusions and gets mad at me if i show him any sort of emotion about things that are going on in my life he just thinks im weak i stopped seeing him because hes a horrible fucking influence but i end up visiting him every week because i want social contact but i just end up regretting it and leaving his house after an hour ive recently been diagnosed with fucking epilepsy so thats fun i have seizures when i dont get enough sleep and i cant because my mum is fucking yelling or if im at my dads house he is up all night singing and working literally all night he sleeps from 6 am to 4 pm so im constantly worried about having a siezure and i try so hard to get good sleep so recently my sleeps been good enough that i dont think im at seizure risk but still bad enough that my health is on a strong and steady decline my brother doesnt talk to me hes becoming an alcoholic i mean hes been drinking everyday for the past year but atleast hes stopped stealing off me and doesnt threaten to beat me up everytime i make eye contact with him anymore i really dont want to kill myself but i have felt so bad my whole life and i cant seem to turn it around that i think if it keeps going it will be the only reasonable option this is fucking bullshit why the fuck are the people around my happy they are all fucking kidding themselves and need to just accept the fact there lives fucking suck so maybe they might actually do something to help themselves and inturn the people that care about them i hate everyone i care about and it makes me so fucking angry i cant ever express this anger to everyone i love thats hurting me because they just seem to treat me worse,490,34,1492.502044
I did it,after years of battling with mental health issues and not seeing the light at the end of the journey i got an unconditional for university and i m going to become a mental health nurse things do get better,491,47,1685.377785
"I hate how people are expected to wait weeks, possibly MONTHS for mental health appointments.",last month i had an appointment that i had to book out two months in advance from then on my next appointment is a month and a half away out of all the things to make people wait for this is probably one of if not the worst does the government or anyone with any position of power understand the consequences of making people who are trying to get their mental health examined wait long periods of time more funding needs to be put into this also i wish society was less toxic and edgy towards each other but i digress i myself am doing okay but i can t imagine the pain others go through when they re told that they have to wait several weeks or even months to get their next appointment and how agonizing it can be it s like you re about to reach the finish line at a race and you slowly shrink in size it taking progressively more and more time energy and probably psychological madness to reach the finish line just felt a need to rant is all,494,117,1913.735331
I showered today.,i didn t want to i almost didn t i kept giving myself reasons to not i even washed my hair my depression and anxiety have been getting worse but i did these things today and i feel a tiny bit better because of it,496,46,1947.040296
I just had sex for the first time since I was raped,when i was 15 i was dating this guy who forced me to sleep with him because he d tell me that no one else would ever love me and that he d kill himself if i didn t fuck him this continued for a year we banged 6 7 times i think and then he ghosted me for two months before breaking up with me over text it s been almost 3 years since we broke up and i have since moved on i just started going to a therapist who thinks i may have ptsd but i am not officially diagnosed last month i started dating a guy who i love more than anything we tried to have sex near the beginning of our relationship but i had a panic attack and complete mental breakdown we didn t try again until monday night and i was able to not only have sex with him but also orgasm it s been such a long struggle but now i think i ve met my soulmate and i don t know if i can be happier thank you for reading,490,31,2169.16628
